{
  "event_id": "MARS160-2017-EVT001",
  "mission_id": "MARS160-2017",
  "sol": 15,
  "event_type": "Failure",
  "system_category": "Meteorological",
  "significance": "Medium",
  "description": "Fog reduced visibility to 50 m on multiple EVA days. One EVA was attempted then cancelled mid-preparation.",
  "response": "The Commander authorised an out-of-sim, unsuited EVA when fog partially cleared, accepting reduced fidelity to protect scientific objectives.",
  "lesson": "Define visibility thresholds for EVA go/no-go in advance. Have a clear protocol for out-of-sim EVA authorisation when conditions preclude simulation but objectives are at risk.",
  "pattern_tag": "fog EVA go/no-go threshold",
  "outcome": "Worked Around",
  "confidence": "C",
  "source_citation": "SRC-hypatia-iii-brief, Part IV – Incident and emergency register, §4.2 Meteorological incidents, lines 599-604. Register Crew tag: 'Mars160'. Sol: not stated anywhere in the source for Mars160; no sol structure is given for this mission at all (see MARS160-2017.json's own high-uncertainty date flags) — placed at an arbitrary mid-mission placeholder. Confidence (C) rationale: Commander-authorisation narrative; reads as an XO/Commander-report style account rather than a formal engineering log.",
  "verified_by": "ASG",
  "source_id": "SRC-hypatia-iii-brief"
}
