{
  "event_id": "FMARS-C15-2023-EVT012",
  "mission_id": "FMARS-C15-2023",
  "sol": 1,
  "event_type": "Near-Miss",
  "system_category": "Psychological",
  "significance": "Low",
  "description": "Daily meditation sessions (twice per day) with heart rate variability tracking were implemented as a formal mission activity and human factors study element.",
  "response": "Crew reported positive wellbeing effects. The practice continued throughout simulation.",
  "lesson": "Formal wellbeing practices are operationally important in extreme isolation environments, not optional extras. Consider building a brief daily crew wellbeing check-in into the fixed mission schedule.",
  "pattern_tag": "structured wellbeing practice adoption",
  "outcome": "Adopted",
  "confidence": "A",
  "source_citation": "SRC-hypatia-iii-brief, Part IV – Incident and emergency register, §4.5 Psychological and team dynamics, lines 764-769. Register Crew tag: 'C15'. Sol: not stated precisely; described as continuing 'throughout simulation' — sol 1 used as onset. Confidence (A) rationale: formal human-factors study element with quantitative tracking (HRV) — reads as a formal engineering/science report. system_category note: entry describes a positive/proactive wellbeing practice rather than a failure or a narrowly-avoided incident; forced into the Near-Miss/Failure binary per this task's instructions (this source predates the broadened event_type set) since it documents an institutionalised measure that plausibly helped this crew avoid the psychological degradation seen in other crews (e.g. the Mars160 tension entries) — flagged as the weakest-fit event_type classification in this batch.",
  "verified_by": "ASG"
}
